<?xml version='1.0' encoding='UTF-8'?>
<ROWSET xmlns="http://service.henkilo.sade.vm.fi/types/perusopetus/arvosanat"
        xmlns:xsi="http://www.w3.org/2001/XMLSchema-instance"
        xsi:schemaLocation="http://service.henkilo.sade.vm.fi/types/perusopetus/arvosanat perusopetusArvosanat.xsd">
    <ROW>
        <VUOSI>2013</VUOSI>
        <KAUSI>S</KAUSI>
        <LAHTOKOULU>05536</LAHTOKOULU>
        <LUOKKA>9A</LUOKKA>
        <LUOKKATASO>9</LUOKKATASO>
        <HETU>111193-111V</HETU>
        <TODISTUS>1</TODISTUS>
        <AINE>A1</AINE>
        <KIELI>FI</KIELI>
        <TYYPPI>B</TYYPPI>
        <ARVOSANA>10</ARVOSANA>
        <ERA>PKERA3_2013S_05536</ERA>
    </ROW>
</ROWSET>
